### ISSUE TITLE
Unexpected end of request content  k8s pod

### ISSUE THREAD

**Issue by wxnt** [aspnet/AspNetCore#16807]
We have been intermittently seeing issues with our  Pod hosted service on a k8s cluster where for a fraction of the requests we start seeing this exception.

I want to understand 2 things -

What could be the possible reasons for this happening in our scenario?
What is the best way to debug this issue ?
Here is the callstack from the exception
message：
Unexpected end of request content.

   at Microsoft.AspNetCore.Server.Kestrel.Core.BadHttpRequestException.Throw(RequestRejectionReason reason)
   at Microsoft.AspNetCore.Server.Kestrel.Core.Internal.Http.Http1ContentLengthMessageBody.ReadAsyncInternal(CancellationToken cancellationToken)
   at Microsoft.AspNetCore.Server.Kestrel.Core.Internal.Http.HttpRequestStream.ReadAsyncInternal(Memory`1 buffer, CancellationToken cancellationToken)
   at System.IO.StreamReader.ReadBufferAsync()
   at System.IO.StreamReader.ReadToEndAsyncInternal()

**Comment by anurse** [comment]
Can you provide a network trace? (If it's difficult to get one from the server side, you could try getting one from the client)

This generally indicates a malformed request from the client, possibly because the client disconnected while transmitting the body. Do you have a proxy or front-end in place (k8s ingress perhaps?)

**Comment by tkstanczak** [comment]
we are investigating the same issue on the trafic mirrored via haproxy:
![image](https://user-images.githubusercontent.com/498913/68520130-46d17d80-028d-11ea-95ef-75aa170f4d42.png)

**Comment by tkstanczak** [comment]
It might be just the behaviour of the client (haproxy agent) but since you are looking for more info and there is a newly open issue then maybe it is related:

2019-11-08 23:55:39.4645|ERROR|28|JsonWebAPI.Microsoft.AspNetCore.Server.Kestrel|Connection id "0HLR4KO5VLB4A", Request id "0HLR4KO5VLB4A:00000001": An unhandled exception was thrown by the application. Microsoft.AspNetCore.Server.Kestrel.Core.BadHttpRequestException: Unexpected end of request content.
   at Microsoft.AspNetCore.Server.Kestrel.Core.BadHttpRequestException.Throw(RequestRejectionReason reason)
   at Microsoft.AspNetCore.Server.Kestrel.Core.Internal.Http.Http1ContentLengthMessageBody.ReadAsyncInternal(CancellationToken cancellationToken)
   at Microsoft.AspNetCore.Server.Kestrel.Core.Internal.Http.HttpRequestStream.ReadAsyncInternal(Memory`1 buffer, CancellationToken cancellationToken)
   at System.IO.StreamReader.ReadBufferAsync()
   at System.IO.StreamReader.ReadToEndAsyncInternal()

This is on Ubuntu 18.04

**Comment by halter73** [comment]
@tkstanczak Do you have a network trace by chance? Kestrel expects HTTP clients to keep connections fully open until the clients receive a full *response*. Otherwise, Kestrel treats the connection as aborted as soon as a FIN is received even if a complete request body was sent first.

For this reason, Kestrel can throw "BadHttpRequestException: Unexpected end of request content." even if the entire request body was sent if a FIN was also sent before the entire response was received by the client. I wonder if that's what's happening here.

**Comment by tkstanczak** [comment]
we will try to collect the network trace:
https://github.com/NethermindEth/nethermind/issues/966

**Comment by tkstanczak** [comment]
@halter73 very likely -I think that haproxy does not care about the responses since it is just trying to mirror the server workload

**Comment by spetz** [comment]
This is the trace collected with `tcpdump`, below you can find the requests that resulted in an error from Kestrel.

```
09:11:46.643111 IP 140.82.54.255.vultr.com.39448 > neth-poa-xdai.8545: Flags [P.], seq 4119927487:4119928352, ack 1946037278, win 502, options [nop,nop,TS val 3403240205 ecr 4053717786], length 865
	0x0000:  4500 0395 6c09 4000 3706 d472 8c52 36ff  E...l.@.7..r.R6.
	0x0010:  86d1 b5c4 9a18 2161 f591 1abf 73fe 2c1e  ......!a....s.,.
	0x0020:  8018 01f6 5d30 0000 0101 080a cad9 530d  ....]0........S.
	0x0030:  f19e d31a 504f 5354 202f 2048 5454 502f  ....POST./.HTTP/
	0x0040:  312e 310d 0a48 6f73 743a 2064 6169 2e70  1.1..Host:.dai.p
	0x0050:  6f61 2e6e 6574 776f 726b 0d0a 5573 6572  oa.network..User
	0x0060:  2d41 6765 6e74 3a20 4d6f 7a69 6c6c 612f  -Agent:.Mozilla/
	0x0070:  352e 3020 2857 696e 646f 7773 204e 5420  5.0.(Windows.NT.
	0x0080:  362e 333b 2057 696e 3634 3b20 7836 3429  6.3;.Win64;.x64)
	0x0090:  2041 7070 6c65 5765 624b 6974 2f35 3337  .AppleWebKit/537
	0x00a0:  2e33 3620 284b 4854 4d4c 2c20 6c69 6b65  .36.(KHTML,.like
	0x00b0:  2047 6563 6b6f 2920 4368 726f 6d65 2f37  .Gecko).Chrome/7
	0x00c0:  382e 302e 3339 3034 2e38 3720 5361 6661  8.0.3904.87.Safa
	0x00d0:  7269 2f35 3337 2e33 360d 0a43 6f6e 6e65  ri/537.36..Conne
	0x00e0:  6374 696f 6e3a 2063 6c6f 7365 0d0a 436f  ction:.close..Co
	0x00f0:  6e74 656e 742d 4c65 6e67 7468 3a20 3638  ntent-Length:.68
	0x0100:  0d0a 4163 6365 7074 3a20 6170 706c 6963  ..Accept:.applic
	0x0110:  6174 696f 6e2f 6a73 6f6e 0d0a 4163 6365  ation/json..Acce
	0x0120:  7074 2d45 6e63 6f64 696e 673a 2067 7a69  pt-Encoding:.gzi
	0x0130:  700d 0a41 6363 6570 742d 4c61 6e67 7561  p..Accept-Langua
	0x0140:  6765 3a20 7275 2d52 552c 7275 3b71 3d30  ge:.ru-RU,ru;q=0
	0x0150:  2e39 2c65 6e2d 5553 3b71 3d30 2e38 2c65  .9,en-US;q=0.8,e
	0x0160:  6e3b 713d 302e 370d 0a43 646e 2d4c 6f6f  n;q=0.7..Cdn-Loo
	0x0170:  703a 2063 6c6f 7564 666c 6172 650d 0a43  p:.cloudflare..C
	0x0180:  662d 436f 6e6e 6563 7469 6e67 2d49 703a  f-Connecting-Ip:
	0x0190:  2031 3938 2e31 362e 3738 2e34 350d 0a43  .198.16.78.45..C
	0x01a0:  662d 4970 636f 756e 7472 793a 204e 4c0d  f-Ipcountry:.NL.
	0x01b0:  0a43 662d 5261 793a 2035 3332 6561 3934  .Cf-Ray:.532ea94
	0x01c0:  3435 6430 6563 3833 662d 414d 530d 0a43  45d0ec83f-AMS..C
	0x01d0:  662d 5669 7369 746f 723a 207b 2273 6368  f-Visitor:.{"sch
	0x01e0:  656d 6522 3a22 6874 7470 7322 7d0d 0a43  eme":"https"}..C
	0x01f0:  6f6e 7465 6e74 2d54 7970 653a 2061 7070  ontent-Type:.app
	0x0200:  6c69 6361 7469 6f6e 2f6a 736f 6e0d 0a43  lication/json..C
	0x0210:  6f6f 6b69 653a 205f 5f63 6664 7569 643d  ookie:.__cfduid=
	0x0220:  6466 6366 3561 3961 3138 3665 6566 6535  dfcf5a9a186eefe5
	0x0230:  6539 3738 3538 3165 3361 6361 6632 6630  e978581e3acaf2f0
	0x0240:  3931 3537 3138 3133 3238 340d 0a44 6e74  91571813284..Dnt
	0x0250:  3a20 310d 0a4f 7269 6769 6e3a 2063 6872  :.1..Origin:.chr
	0x0260:  6f6d 652d 6578 7465 6e73 696f 6e3a 2f2f  ome-extension://
	0x0270:  6f64 6266 7065 6569 6864 6b62 6968 6d6f  odbfpeeihdkbihmo
	0x0280:  706b 626a 6d6f 6f6e 6661 6e6c 6266 636c  pkbjmoonfanlbfcl
	0x0290:  0d0a 5365 632d 4665 7463 682d 4d6f 6465  ..Sec-Fetch-Mode
	0x02a0:  3a20 636f 7273 0d0a 5365 632d 4665 7463  :.cors..Sec-Fetc
	0x02b0:  682d 5369 7465 3a20 6372 6f73 732d 7369  h-Site:.cross-si
	0x02c0:  7465 0d0a 582d 466f 7277 6172 6465 642d  te..X-Forwarded-
	0x02d0:  466f 723a 2031 3938 2e31 362e 3738 2e34  For:.198.16.78.4
	0x02e0:  350d 0a58 2d46 6f72 7761 7264 6564 2d46  5..X-Forwarded-F
	0x02f0:  6f72 3a20 3136 322e 3135 382e 3131 312e  or:.162.158.111.
	0x0300:  3939 0d0a 582d 466f 7277 6172 6465 642d  99..X-Forwarded-
	0x0310:  506f 7274 3a20 3434 330d 0a58 2d46 6f72  Port:.443..X-For
	0x0320:  7761 7264 6564 2d50 726f 746f 3a20 6874  warded-Proto:.ht
	0x0330:  7470 730d 0a58 2d46 6f72 7761 7264 6564  tps..X-Forwarded
	0x0340:  2d50 726f 746f 3a20 6874 7470 730d 0a0d  -Proto:.https...
	0x0350:  0a7b 226a 736f 6e72 7063 223a 2232 2e30  .{"jsonrpc":"2.0
	0x0360:  222c 2269 6422 3a34 3231 3733 3031 3138  ","id":421730118
	0x0370:  312c 226d 6574 686f 6422 3a22 6e65 745f  1,"method":"net_
	0x0380:  7665 7273 696f 6e22 2c22 7061 7261 6d73  version","params
	0x0390:  223a 5b5d 7d                             ":[]}
09:11:47.603012 IP 140.82.54.255.vultr.com.39452 > neth-poa-xdai.8545: Flags [P.], seq 4181870726:4181871536, ack 1259296972, win 502, options [nop,nop,TS val 3403241165 ecr 4053718746], length 810
	0x0000:  4500 035e 3f2e 4000 3706 0185 8c52 36ff  E..^?.@.7....R6.
	0x0010:  86d1 b5c4 9a1c 2161 f942 4886 4b0f 58cc  ......!a.BH.K.X.
	0x0020:  8018 01f6 da80 0000 0101 080a cad9 56cd  ..............V.
	0x0030:  f19e d6da 504f 5354 202f 2048 5454 502f  ....POST./.HTTP/
	0x0040:  312e 310d 0a48 6f73 743a 2064 6169 2e70  1.1..Host:.dai.p
	0x0050:  6f61 2e6e 6574 776f 726b 0d0a 5573 6572  oa.network..User
	0x0060:  2d41 6765 6e74 3a20 4d6f 7a69 6c6c 612f  -Agent:.Mozilla/
	0x0070:  352e 3020 2857 696e 646f 7773 204e 5420  5.0.(Windows.NT.
	0x0080:  362e 333b 2057 696e 3634 3b20 7836 3429  6.3;.Win64;.x64)
	0x0090:  2041 7070 6c65 5765 624b 6974 2f35 3337  .AppleWebKit/537
	0x00a0:  2e33 3620 284b 4854 4d4c 2c20 6c69 6b65  .36.(KHTML,.like
	0x00b0:  2047 6563 6b6f 2920 4368 726f 6d65 2f37  .Gecko).Chrome/7
	0x00c0:  382e 302e 3339 3034 2e38 3720 5361 6661  8.0.3904.87.Safa
	0x00d0:  7269 2f35 3337 2e33 360d 0a43 6f6e 6e65  ri/537.36..Conne
	0x00e0:  6374 696f 6e3a 2063 6c6f 7365 0d0a 436f  ction:.close..Co
	0x00f0:  6e74 656e 742d 4c65 6e67 7468 3a20 3635  ntent-Length:.65
	0x0100:  0d0a 4163 6365 7074 3a20 2a2f 2a0d 0a41  ..Accept:.*/*..A
	0x0110:  6363 6570 742d 456e 636f 6469 6e67 3a20  ccept-Encoding:.
	0x0120:  677a 6970 0d0a 4163 6365 7074 2d4c 616e  gzip..Accept-Lan
	0x0130:  6775 6167 653a 2072 752d 5255 2c72 753b  guage:.ru-RU,ru;
	0x0140:  713d 302e 392c 656e 2d55 533b 713d 302e  q=0.9,en-US;q=0.
	0x0150:  382c 656e 3b71 3d30 2e37 0d0a 4364 6e2d  8,en;q=0.7..Cdn-
	0x0160:  4c6f 6f70 3a20 636c 6f75 6466 6c61 7265  Loop:.cloudflare
	0x0170:  0d0a 4366 2d43 6f6e 6e65 6374 696e 672d  ..Cf-Connecting-
	0x0180:  4970 3a20 3139 382e 3136 2e37 382e 3435  Ip:.198.16.78.45
	0x0190:  0d0a 4366 2d49 7063 6f75 6e74 7279 3a20  ..Cf-Ipcountry:.
	0x01a0:  4e4c 0d0a 4366 2d52 6179 3a20 3533 3265  NL..Cf-Ray:.532e
	0x01b0:  6139 3461 3562 6166 3964 3138 2d41 4d53  a94a5baf9d18-AMS
	0x01c0:  0d0a 4366 2d56 6973 6974 6f72 3a20 7b22  ..Cf-Visitor:.{"
	0x01d0:  7363 6865 6d65 223a 2268 7474 7073 227d  scheme":"https"}
	0x01e0:  0d0a 436f 6e74 656e 742d 5479 7065 3a20  ..Content-Type:.
	0x01f0:  6170 706c 6963 6174 696f 6e2f 6a73 6f6e  application/json
	0x0200:  0d0a 446e 743a 2031 0d0a 4f72 6967 696e  ..Dnt:.1..Origin
	0x0210:  3a20 6874 7470 733a 2f2f 706d 2e68 656c  :.https://pm.hel
	0x0220:  656e 612e 6e65 7477 6f72 6b0d 0a52 6566  ena.network..Ref
	0x0230:  6572 6572 3a20 6874 7470 733a 2f2f 706d  erer:.https://pm
	0x0240:  2e68 656c 656e 612e 6e65 7477 6f72 6b2f  .helena.network/
	0x0250:  6d61 726b 6574 732f 6c69 7374 0d0a 5365  markets/list..Se
	0x0260:  632d 4665 7463 682d 4d6f 6465 3a20 636f  c-Fetch-Mode:.co
	0x0270:  7273 0d0a 5365 632d 4665 7463 682d 5369  rs..Sec-Fetch-Si
	0x0280:  7465 3a20 6372 6f73 732d 7369 7465 0d0a  te:.cross-site..
	0x0290:  582d 466f 7277 6172 6465 642d 466f 723a  X-Forwarded-For:
	0x02a0:  2031 3938 2e31 362e 3738 2e34 350d 0a58  .198.16.78.45..X
	0x02b0:  2d46 6f72 7761 7264 6564 2d46 6f72 3a20  -Forwarded-For:.
	0x02c0:  3136 322e 3135 382e 3131 312e 3231 0d0a  162.158.111.21..
	0x02d0:  582d 466f 7277 6172 6465 642d 506f 7274  X-Forwarded-Port
	0x02e0:  3a20 3434 330d 0a58 2d46 6f72 7761 7264  :.443..X-Forward
	0x02f0:  6564 2d50 726f 746f 3a20 6874 7470 730d  ed-Proto:.https.
	0x0300:  0a58 2d46 6f72 7761 7264 6564 2d50 726f  .X-Forwarded-Pro
	0x0310:  746f 3a20 6874 7470 730d 0a0d 0a7b 226a  to:.https....{"j
	0x0320:  736f 6e72 7063 223a 2232 2e30 222c 2269  sonrpc":"2.0","i
	0x0330:  6422 3a36 3131 3533 392c 226d 6574 686f  d":611539,"metho
	0x0340:  6422 3a22 6574 685f 6163 636f 756e 7473  d":"eth_accounts
	0x0350:  222c 2270 6172 616d 7322 3a5b 5d7d       ","params":[]}
09:11:47.619711 IP 140.82.54.255.vultr.com.39454 > neth-poa-xdai.8545: Flags [P.], seq 1215953565:1215954430, ack 1232772899, win 502, options [nop,nop,TS val 3403241182 ecr 4053718763], length 865
	0x0000:  4500 0395 8d34 4000 3706 b347 8c52 36ff  E....4@.7..G.R6.
	0x0010:  86d1 b5c4 9a1e 2161 4879 fa9d 497a 9f23  ......!aHy..Iz.#
	0x0020:  8018 01f6 d80b 0000 0101 080a cad9 56de  ..............V.
	0x0030:  f19e d6eb 504f 5354 202f 2048 5454 502f  ....POST./.HTTP/
	0x0040:  312e 310d 0a48 6f73 743a 2064 6169 2e70  1.1..Host:.dai.p
	0x0050:  6f61 2e6e 6574 776f 726b 0d0a 5573 6572  oa.network..User
	0x0060:  2d41 6765 6e74 3a20 4d6f 7a69 6c6c 612f  -Agent:.Mozilla/
	0x0070:  352e 3020 2857 696e 646f 7773 204e 5420  5.0.(Windows.NT.
	0x0080:  362e 333b 2057 696e 3634 3b20 7836 3429  6.3;.Win64;.x64)
	0x0090:  2041 7070 6c65 5765 624b 6974 2f35 3337  .AppleWebKit/537
	0x00a0:  2e33 3620 284b 4854 4d4c 2c20 6c69 6b65  .36.(KHTML,.like
	0x00b0:  2047 6563 6b6f 2920 4368 726f 6d65 2f37  .Gecko).Chrome/7
	0x00c0:  382e 302e 3339 3034 2e38 3720 5361 6661  8.0.3904.87.Safa
	0x00d0:  7269 2f35 3337 2e33 360d 0a43 6f6e 6e65  ri/537.36..Conne
	0x00e0:  6374 696f 6e3a 2063 6c6f 7365 0d0a 436f  ction:.close..Co
	0x00f0:  6e74 656e 742d 4c65 6e67 7468 3a20 3638  ntent-Length:.68
	0x0100:  0d0a 4163 6365 7074 3a20 6170 706c 6963  ..Accept:.applic
	0x0110:  6174 696f 6e2f 6a73 6f6e 0d0a 4163 6365  ation/json..Acce
	0x0120:  7074 2d45 6e63 6f64 696e 673a 2067 7a69  pt-Encoding:.gzi
	0x0130:  700d 0a41 6363 6570 742d 4c61 6e67 7561  p..Accept-Langua
	0x0140:  6765 3a20 7275 2d52 552c 7275 3b71 3d30  ge:.ru-RU,ru;q=0
	0x0150:  2e39 2c65 6e2d 5553 3b71 3d30 2e38 2c65  .9,en-US;q=0.8,e
	0x0160:  6e3b 713d 302e 370d 0a43 646e 2d4c 6f6f  n;q=0.7..Cdn-Loo
	0x0170:  703a 2063 6c6f 7564 666c 6172 650d 0a43  p:.cloudflare..C
	0x0180:  662d 436f 6e6e 6563 7469 6e67 2d49 703a  f-Connecting-Ip:
	0x0190:  2031 3938 2e31 362e 3738 2e34 350d 0a43  .198.16.78.45..C
	0x01a0:  662d 4970 636f 756e 7472 793a 204e 4c0d  f-Ipcountry:.NL.
	0x01b0:  0a43 662d 5261 793a 2035 3332 6561 3934  .Cf-Ray:.532ea94
	0x01c0:  6137 6663 3563 3833 662d 414d 530d 0a43  a7fc5c83f-AMS..C
	0x01d0:  662d 5669 7369 746f 723a 207b 2273 6368  f-Visitor:.{"sch
	0x01e0:  656d 6522 3a22 6874 7470 7322 7d0d 0a43  eme":"https"}..C
	0x01f0:  6f6e 7465 6e74 2d54 7970 653a 2061 7070  ontent-Type:.app
	0x0200:  6c69 6361 7469 6f6e 2f6a 736f 6e0d 0a43  lication/json..C
	0x0210:  6f6f 6b69 653a 205f 5f63 6664 7569 643d  ookie:.__cfduid=
	0x0220:  6466 6366 3561 3961 3138 3665 6566 6535  dfcf5a9a186eefe5
	0x0230:  6539 3738 3538 3165 3361 6361 6632 6630  e978581e3acaf2f0
	0x0240:  3931 3537 3138 3133 3238 340d 0a44 6e74  91571813284..Dnt
	0x0250:  3a20 310d 0a4f 7269 6769 6e3a 2063 6872  :.1..Origin:.chr
	0x0260:  6f6d 652d 6578 7465 6e73 696f 6e3a 2f2f  ome-extension://
	0x0270:  6f64 6266 7065 6569 6864 6b62 6968 6d6f  odbfpeeihdkbihmo
	0x0280:  706b 626a 6d6f 6f6e 6661 6e6c 6266 636c  pkbjmoonfanlbfcl
	0x0290:  0d0a 5365 632d 4665 7463 682d 4d6f 6465  ..Sec-Fetch-Mode
	0x02a0:  3a20 636f 7273 0d0a 5365 632d 4665 7463  :.cors..Sec-Fetc
	0x02b0:  682d 5369 7465 3a20 6372 6f73 732d 7369  h-Site:.cross-si
	0x02c0:  7465 0d0a 582d 466f 7277 6172 6465 642d  te..X-Forwarded-
	0x02d0:  466f 723a 2031 3938 2e31 362e 3738 2e34  For:.198.16.78.4
	0x02e0:  350d 0a58 2d46 6f72 7761 7264 6564 2d46  5..X-Forwarded-F
	0x02f0:  6f72 3a20 3136 322e 3135 382e 3131 312e  or:.162.158.111.
	0x0300:  3939 0d0a 582d 466f 7277 6172 6465 642d  99..X-Forwarded-
	0x0310:  506f 7274 3a20 3434 330d 0a58 2d46 6f72  Port:.443..X-For
	0x0320:  7761 7264 6564 2d50 726f 746f 3a20 6874  warded-Proto:.ht
	0x0330:  7470 730d 0a58 2d46 6f72 7761 7264 6564  tps..X-Forwarded
	0x0340:  2d50 726f 746f 3a20 6874 7470 730d 0a0d  -Proto:.https...
	0x0350:  0a7b 226a 736f 6e72 7063 223a 2232 2e30  .{"jsonrpc":"2.0
	0x0360:  222c 2269 6422 3a34 3231 3733 3031 3138  ","id":421730118
	0x0370:  342c 226d 6574 686f 6422 3a22 6e65 745f  4,"method":"net_
	0x0380:  7665 7273 696f 6e22 2c22 7061 7261 6d73  version","params
	0x0390:  223a 5b5d 7d                             ":[]}
09:11:47.916620 IP 140.82.54.255.vultr.com.39978 > neth-poa-xdai.8545: Flags [P.], seq 1528157102:1528158022, ack 2686285454, win 502, options [nop,nop,TS val 3403241479 ecr 4053719060], length 920
	0x0000:  4500 03cc a457 4000 3706 9bed 8c52 36ff  E....W@.7....R6.
	0x0010:  86d1 b5c4 9c2a 2161 5b15 d3ae a01d 768e  .....*!a[.....v.
	0x0020:  8018 01f6 ca08 0000 0101 080a cad9 5807  ..............X.
	0x0030:  f19e d814 504f 5354 202f 2048 5454 502f  ....POST./.HTTP/
	0x0040:  312e 310d 0a48 6f73 743a 2064 6169 2e70  1.1..Host:.dai.p
	0x0050:  6f61 2e6e 6574 776f 726b 0d0a 5573 6572  oa.network..User
	0x0060:  2d41 6765 6e74 3a20 4d6f 7a69 6c6c 612f  -Agent:.Mozilla/
	0x0070:  352e 3020 2857 696e 646f 7773 204e 5420  5.0.(Windows.NT.
	0x0080:  3130 2e30 3b20 5769 6e36 343b 2078 3634  10.0;.Win64;.x64
	0x0090:  2920 4170 706c 6557 6562 4b69 742f 3533  ).AppleWebKit/53
	0x00a0:  372e 3336 2028 4b48 544d 4c2c 206c 696b  7.36.(KHTML,.lik
	0x00b0:  6520 4765 636b 6f29 2043 6872 6f6d 652f  e.Gecko).Chrome/
	0x00c0:  3738 2e30 2e33 3930 342e 3730 2053 6166  78.0.3904.70.Saf
	0x00d0:  6172 692f 3533 372e 3336 0d0a 436f 6e6e  ari/537.36..Conn
	0x00e0:  6563 7469 6f6e 3a20 636c 6f73 650d 0a43  ection:.close..C
	0x00f0:  6f6e 7465 6e74 2d4c 656e 6774 683a 2039  ontent-Length:.9
	0x0100:  380d 0a41 6363 6570 743a 2061 7070 6c69  8..Accept:.appli
	0x0110:  6361 7469 6f6e 2f6a 736f 6e0d 0a41 6363  cation/json..Acc
	0x0120:  6570 742d 456e 636f 6469 6e67 3a20 677a  ept-Encoding:.gz
	0x0130:  6970 0d0a 4163 6365 7074 2d4c 616e 6775  ip..Accept-Langu
	0x0140:  6167 653a 2065 6e2d 5553 2c65 6e3b 713d  age:.en-US,en;q=
	0x0150:  302e 390d 0a43 646e 2d4c 6f6f 703a 2063  0.9..Cdn-Loop:.c
	0x0160:  6c6f 7564 666c 6172 650d 0a43 662d 436f  loudflare..Cf-Co
	0x0170:  6e6e 6563 7469 6e67 2d49 703a 2032 3630  nnecting-Ip:.260
	0x0180:  303a 3663 3637 3a36 6438 303a 3266 3963  0:6c67:6d80:2f9c
	0x0190:  3a64 3936 343a 6337 3434 3a65 6534 3a32  :d964:c744:ee4:2
	0x01a0:  3434 390d 0a43 662d 4970 636f 756e 7472  449..Cf-Ipcountr
	0x01b0:  793a 2055 530d 0a43 662d 5261 793a 2035  y:.US..Cf-Ray:.5
	0x01c0:  3332 6561 3934 6265 6364 3965 3337 322d  32ea94becd9e372-
	0x01d0:  5345 410d 0a43 662d 5669 7369 746f 723a  SEA..Cf-Visitor:
	0x01e0:  207b 2273 6368 656d 6522 3a22 6874 7470  .{"scheme":"http
	0x01f0:  7322 7d0d 0a43 6f6e 7465 6e74 2d54 7970  s"}..Content-Typ
	0x0200:  653a 2061 7070 6c69 6361 7469 6f6e 2f6a  e:.application/j
	0x0210:  736f 6e0d 0a43 6f6f 6b69 653a 205f 5f63  son..Cookie:.__c
	0x0220:  6664 7569 643d 6430 3665 3239 3639 3236  fduid=d06e296926
	0x0230:  3537 3564 6364 6130 6339 3137 6262 3331  575dcda0c917bb31
	0x0240:  6437 3637 6532 3431 3536 3931 3635 3736  d767e24156916576
	0x0250:  390d 0a4f 7269 6769 6e3a 2063 6872 6f6d  9..Origin:.chrom
	0x0260:  652d 6578 7465 6e73 696f 6e3a 2f2f 6862  e-extension://hb
	0x0270:  686a 6f6e 686a 6a6b 646b 6f6b 6968 6568  hjonhjjkdkokiheh
	0x0280:  6465 6969 6161 6662 6d61 6e69 6463 0d0a  deiiaafbmanidc..
	0x0290:  5365 632d 4665 7463 682d 4d6f 6465 3a20  Sec-Fetch-Mode:.
	0x02a0:  636f 7273 0d0a 5365 632d 4665 7463 682d  cors..Sec-Fetch-
	0x02b0:  5369 7465 3a20 6372 6f73 732d 7369 7465  Site:.cross-site
	0x02c0:  0d0a 582d 466f 7277 6172 6465 642d 466f  ..X-Forwarded-Fo
	0x02d0:  723a 2032 3630 303a 3663 3637 3a36 6438  r:.2600:6c67:6d8
	0x02e0:  303a 3266 3963 3a64 3936 343a 6337 3434  0:2f9c:d964:c744
	0x02f0:  3a65 6534 3a32 3434 390d 0a58 2d46 6f72  :ee4:2449..X-For
	0x0300:  7761 7264 6564 2d46 6f72 3a20 3136 322e  warded-For:.162.
	0x0310:  3135 382e 3130 362e 3232 340d 0a58 2d46  158.106.224..X-F
	0x0320:  6f72 7761 7264 6564 2d50 6f72 743a 2034  orwarded-Port:.4
	0x0330:  3433 0d0a 582d 466f 7277 6172 6465 642d  43..X-Forwarded-
	0x0340:  5072 6f74 6f3a 2068 7474 7073 0d0a 582d  Proto:.https..X-
	0x0350:  466f 7277 6172 6465 642d 5072 6f74 6f3a  Forwarded-Proto:
	0x0360:  2068 7474 7073 0d0a 0d0a 7b22 6964 223a  .https....{"id":
	0x0370:  3535 3931 3536 3432 3136 3835 3134 3536  5591564216851456
	0x0380:  2c22 6a73 6f6e 7270 6322 3a22 322e 3022  ,"jsonrpc":"2.0"
	0x0390:  2c22 7061 7261 6d73 223a 5b22 3078 3636  ,"params":["0x66
	0x03a0:  6166 3764 222c 7472 7565 5d2c 226d 6574  af7d",true],"met
	0x03b0:  686f 6422 3a22 6574 685f 6765 7442 6c6f  hod":"eth_getBlo
	0x03c0:  636b 4279 4e75 6d62 6572 227d            ckByNumber"}
09:11:48.529420 IP 140.82.54.255.vultr.com.57680 > neth-poa-xdai.8545: Flags [P.], seq 2995783920:2995784758, ack 3996445756, win 502, options [nop,nop,TS val 3403242091 ecr 4053719672], length 838
	0x0000:  4500 037a 7080 4000 3706 d016 8c52 36ff  E..zp.@.7....R6.
	0x0010:  86d1 b5c4 e150 2161 b290 08f0 ee34 ec3c  .....P!a.....4.<
	0x0020:  8018 01f6 397f 0000 0101 080a cad9 5a6b  ....9.........Zk
	0x0030:  f19e da78 504f 5354 202f 2048 5454 502f  ...xPOST./.HTTP/
	0x0040:  312e 310d 0a48 6f73 743a 2064 6169 2e70  1.1..Host:.dai.p
	0x0050:  6f61 2e6e 6574 776f 726b 0d0a 5573 6572  oa.network..User
	0x0060:  2d41 6765 6e74 3a20 4d6f 7a69 6c6c 612f  -Agent:.Mozilla/
	0x0070:  352e 3020 284d 6163 696e 746f 7368 3b20  5.0.(Macintosh;.
	0x0080:  496e 7465 6c20 4d61 6320 4f53 2058 2031  Intel.Mac.OS.X.1
	0x0090:  305f 3135 5f31 2920 4170 706c 6557 6562  0_15_1).AppleWeb
	0x00a0:  4b69 742f 3533 372e 3336 2028 4b48 544d  Kit/537.36.(KHTM
	0x00b0:  4c2c 206c 696b 6520 4765 636b 6f29 2043  L,.like.Gecko).C
	0x00c0:  6872 6f6d 652f 3738 2e30 2e33 3930 342e  hrome/78.0.3904.
	0x00d0:  3837 2053 6166 6172 692f 3533 372e 3336  87.Safari/537.36
	0x00e0:  0d0a 436f 6e6e 6563 7469 6f6e 3a20 636c  ..Connection:.cl
	0x00f0:  6f73 650d 0a43 6f6e 7465 6e74 2d4c 656e  ose..Content-Len
	0x0100:  6774 683a 2036 330d 0a41 6363 6570 743a  gth:.63..Accept:
	0x0110:  2061 7070 6c69 6361 7469 6f6e 2f6a 736f  .application/jso
	0x0120:  6e0d 0a41 6363 6570 742d 456e 636f 6469  n..Accept-Encodi
	0x0130:  6e67 3a20 677a 6970 0d0a 4163 6365 7074  ng:.gzip..Accept
	0x0140:  2d4c 616e 6775 6167 653a 2065 6e2d 5553  -Language:.en-US
	0x0150:  2c65 6e3b 713d 302e 390d 0a43 646e 2d4c  ,en;q=0.9..Cdn-L
	0x0160:  6f6f 703a 2063 6c6f 7564 666c 6172 650d  oop:.cloudflare.
	0x0170:  0a43 662d 436f 6e6e 6563 7469 6e67 2d49  .Cf-Connecting-I
	0x0180:  703a 2036 372e 3136 342e 3132 2e31 3337  p:.67.164.12.137
	0x0190:  0d0a 4366 2d49 7063 6f75 6e74 7279 3a20  ..Cf-Ipcountry:.
	0x01a0:  5553 0d0a 4366 2d52 6179 3a20 3533 3265  US..Cf-Ray:.532e
	0x01b0:  6139 3466 6139 3336 6564 3633 2d53 4a43  a94fa936ed63-SJC
	0x01c0:  0d0a 4366 2d56 6973 6974 6f72 3a20 7b22  ..Cf-Visitor:.{"
	0x01d0:  7363 6865 6d65 223a 2268 7474 7073 227d  scheme":"https"}
	0x01e0:  0d0a 436f 6e74 656e 742d 5479 7065 3a20  ..Content-Type:.
	0x01f0:  6170 706c 6963 6174 696f 6e2f 6a73 6f6e  application/json
	0x0200:  0d0a 436f 6f6b 6965 3a20 5f5f 6366 6475  ..Cookie:.__cfdu
	0x0210:  6964 3d64 6132 6666 3531 6466 6161 3666  id=da2ff51dfaa6f
	0x0220:  6564 3335 6634 3537 3632 6439 6130 3433  ed35f45762d9a043
	0x0230:  6161 6232 3135 3730 3635 3331 3732 0d0a  aab21570653172..
	0x0240:  4f72 6967 696e 3a20 6368 726f 6d65 2d65  Origin:.chrome-e
	0x0250:  7874 656e 7369 6f6e 3a2f 2f6e 6b62 6968  xtension://nkbih
	0x0260:  6662 656f 6761 6561 6f65 686c 6566 6e6b  fbeogaeaoehlefnk
	0x0270:  6f64 6265 6667 7067 6b6e 6e0d 0a53 6563  odbefgpgknn..Sec
	0x0280:  2d46 6574 6368 2d4d 6f64 653a 2063 6f72  -Fetch-Mode:.cor
	0x0290:  730d 0a53 6563 2d46 6574 6368 2d53 6974  s..Sec-Fetch-Sit
	0x02a0:  653a 2063 726f 7373 2d73 6974 650d 0a58  e:.cross-site..X
	0x02b0:  2d46 6f72 7761 7264 6564 2d46 6f72 3a20  -Forwarded-For:.
	0x02c0:  3637 2e31 3634 2e31 322e 3133 370d 0a58  67.164.12.137..X
	0x02d0:  2d46 6f72 7761 7264 6564 2d46 6f72 3a20  -Forwarded-For:.
	0x02e0:  3137 322e 3638 2e31 3432 2e37 0d0a 582d  172.68.142.7..X-
	0x02f0:  466f 7277 6172 6465 642d 506f 7274 3a20  Forwarded-Port:.
	0x0300:  3434 330d 0a58 2d46 6f72 7761 7264 6564  443..X-Forwarded
	0x0310:  2d50 726f 746f 3a20 6874 7470 730d 0a58  -Proto:.https..X
	0x0320:  2d46 6f72 7761 7264 6564 2d50 726f 746f  -Forwarded-Proto
	0x0330:  3a20 6874 7470 730d 0a0d 0a7b 2269 6422  :.https....{"id"
	0x0340:  3a31 2c22 6a73 6f6e 7270 6322 3a22 322e  :1,"jsonrpc":"2.
	0x0350:  3022 2c22 6d65 7468 6f64 223a 2265 7468  0","method":"eth
	0x0360:  5f62 6c6f 636b 4e75 6d62 6572 222c 2270  _blockNumber","p
	0x0370:  6172 616d 7322 3a5b 5d7d                 arams":[]}
```

And this one was processed successfully.

```
09:13:09.650978 IP 140.82.54.255.vultr.com.60030 > neth-poa-xdai.8545: Flags [P.], seq 1519860723:1519861585, ack 1881659161, win 502, options [nop,nop,TS val 3403323214 ecr 4053800795], length 862
	0x0000:  4500 0392 fc3a 4000 3706 4444 8c52 36ff  E....:@.7.DD.R6.
	0x0010:  86d1 b5c4 ea7e 2161 5a97 3bf3 7027 d719  .....~!aZ.;.p'..
	0x0020:  8018 01f6 1e07 0000 0101 080a cada 974e  ...............N
	0x0030:  f1a0 175b 504f 5354 202f 2048 5454 502f  ...[POST./.HTTP/
	0x0040:  312e 310d 0a48 6f73 743a 2064 6169 2e70  1.1..Host:.dai.p
	0x0050:  6f61 2e6e 6574 776f 726b 0d0a 5573 6572  oa.network..User
	0x0060:  2d41 6765 6e74 3a20 4d6f 7a69 6c6c 612f  -Agent:.Mozilla/
	0x0070:  352e 3020 2857 696e 646f 7773 204e 5420  5.0.(Windows.NT.
	0x0080:  362e 333b 2057 696e 3634 3b20 7836 3429  6.3;.Win64;.x64)
	0x0090:  2041 7070 6c65 5765 624b 6974 2f35 3337  .AppleWebKit/537
	0x00a0:  2e33 3620 284b 4854 4d4c 2c20 6c69 6b65  .36.(KHTML,.like
	0x00b0:  2047 6563 6b6f 2920 4368 726f 6d65 2f37  .Gecko).Chrome/7
	0x00c0:  382e 302e 3339 3034 2e38 3720 5361 6661  8.0.3904.87.Safa
	0x00d0:  7269 2f35 3337 2e33 360d 0a43 6f6e 6e65  ri/537.36..Conne
	0x00e0:  6374 696f 6e3a 2063 6c6f 7365 0d0a 436f  ction:.close..Co
	0x00f0:  6e74 656e 742d 4c65 6e67 7468 3a20 3131  ntent-Length:.11
	0x0100:  360d 0a41 6363 6570 743a 202a 2f2a 0d0a  6..Accept:.*/*..
	0x0110:  4163 6365 7074 2d45 6e63 6f64 696e 673a  Accept-Encoding:
	0x0120:  2067 7a69 700d 0a41 6363 6570 742d 4c61  .gzip..Accept-La
	0x0130:  6e67 7561 6765 3a20 7275 2d52 552c 7275  nguage:.ru-RU,ru
	0x0140:  3b71 3d30 2e39 2c65 6e2d 5553 3b71 3d30  ;q=0.9,en-US;q=0
	0x0150:  2e38 2c65 6e3b 713d 302e 370d 0a43 646e  .8,en;q=0.7..Cdn
	0x0160:  2d4c 6f6f 703a 2063 6c6f 7564 666c 6172  -Loop:.cloudflar
	0x0170:  650d 0a43 662d 436f 6e6e 6563 7469 6e67  e..Cf-Connecting
	0x0180:  2d49 703a 2031 3938 2e31 362e 3738 2e34  -Ip:.198.16.78.4
	0x0190:  350d 0a43 662d 4970 636f 756e 7472 793a  5..Cf-Ipcountry:
	0x01a0:  204e 4c0d 0a43 662d 5261 793a 2035 3332  .NL..Cf-Ray:.532
	0x01b0:  6561 6234 6231 3863 3063 3739 312d 414d  eab4b18c0c791-AM
	0x01c0:  530d 0a43 662d 5669 7369 746f 723a 207b  S..Cf-Visitor:.{
	0x01d0:  2273 6368 656d 6522 3a22 6874 7470 7322  "scheme":"https"
	0x01e0:  7d0d 0a43 6f6e 7465 6e74 2d54 7970 653a  }..Content-Type:
	0x01f0:  2061 7070 6c69 6361 7469 6f6e 2f6a 736f  .application/jso
	0x0200:  6e0d 0a44 6e74 3a20 310d 0a4f 7269 6769  n..Dnt:.1..Origi
	0x0210:  6e3a 2068 7474 7073 3a2f 2f70 6d2e 6865  n:.https://pm.he
	0x0220:  6c65 6e61 2e6e 6574 776f 726b 0d0a 5265  lena.network..Re
	0x0230:  6665 7265 723a 2068 7474 7073 3a2f 2f70  ferer:.https://p
	0x0240:  6d2e 6865 6c65 6e61 2e6e 6574 776f 726b  m.helena.network
	0x0250:  2f6d 6172 6b65 7473 2f6c 6973 740d 0a53  /markets/list..S
	0x0260:  6563 2d46 6574 6368 2d4d 6f64 653a 2063  ec-Fetch-Mode:.c
	0x0270:  6f72 730d 0a53 6563 2d46 6574 6368 2d53  ors..Sec-Fetch-S
	0x0280:  6974 653a 2063 726f 7373 2d73 6974 650d  ite:.cross-site.
	0x0290:  0a58 2d46 6f72 7761 7264 6564 2d46 6f72  .X-Forwarded-For
	0x02a0:  3a20 3139 382e 3136 2e37 382e 3435 0d0a  :.198.16.78.45..
	0x02b0:  582d 466f 7277 6172 6465 642d 466f 723a  X-Forwarded-For:
	0x02c0:  2031 3632 2e31 3538 2e31 3131 2e39 390d  .162.158.111.99.
	0x02d0:  0a58 2d46 6f72 7761 7264 6564 2d50 6f72  .X-Forwarded-Por
	0x02e0:  743a 2034 3433 0d0a 582d 466f 7277 6172  t:.443..X-Forwar
	0x02f0:  6465 642d 5072 6f74 6f3a 2068 7474 7073  ded-Proto:.https
	0x0300:  0d0a 582d 466f 7277 6172 6465 642d 5072  ..X-Forwarded-Pr
	0x0310:  6f74 6f3a 2068 7474 7073 0d0a 0d0a 7b22  oto:.https....{"
	0x0320:  6a73 6f6e 7270 6322 3a22 322e 3022 2c22  jsonrpc":"2.0","
	0x0330:  6964 223a 3634 3832 302c 226d 6574 686f  id":64820,"metho
	0x0340:  6422 3a22 6574 685f 6765 7443 6f64 6522  d":"eth_getCode"
	0x0350:  2c22 7061 7261 6d73 223a 5b22 3078 3363  ,"params":["0x3c
	0x0360:  3036 6530 3631 3230 3435 6530 6338 3663  06e0612045e0c86c
	0x0370:  6139 3635 3036 3630 3366 3764 3864 3130  a96506603f7d8d10
	0x0380:  3465 6566 3664 222c 226c 6174 6573 7422  4eef6d","latest"
	0x0390:  5d7d                                     ]}
```

**Comment by halter73** [comment]
@spetz Are you also using haproxy? I don't see any FIN or RST flags in the tcpdump output at all, so I don't know why Kestrel would report the "Unexpected end of request content."

Were you getting the exact same "Unexpected end of request content." BadHttpRequestException as @wxnt and @tkstanczak when you collected the tcpdump?

**Comment by spetz** [comment]
@halter73 I'm working with @tkstanczak and this is the trace from our VM behind haproxy. Could we provide more details by using some additional tools for collecting network traces on Linux?

**Comment by anurse** [comment]
Can you get a pcap file out of `tcpdump`? That would give us much more detail to investigate further.

**Comment by spetz** [comment]
@anurse apologies for the delay, here's the file (I think about 10-20 final requests turned out to be invalid).

[kestrel.zip](https://github.com/aspnet/AspNetCore/files/3857928/kestrel.zip)

**Comment by anurse** [comment]
@spetz Thanks! That should help us diagnose. @halter73 can you take a look at the full trace and see if something interesting shows up?

**Comment by tkstanczak** [comment]
we have been just comparing the same code between 2.2 and 3.0 and this has definitely been just introduced in 3.0

when load testing with NBomber we get these exceptions whenever a single test round finishes against 3.0 and no exceptions in 2.2

**Comment by halter73** [comment]
Unfortunately the pcap file also doesn't include any tcp packets containing FIN or RST flags. Http1ContentLengthMessageBody.ReadAsyncInternal only throws this exception of the ReadResult returned from the connection-level PipeReader IsCompleted. The only way I know this can happen is if there's a FIN from the client or some sort of socket error.

Can someone who's seen these errors include all the surrounding trace-level logs? The transport should be logging why it's completing the connection-level pipes.

**Comment by halter73** [comment]
@tkstanczak you're not calling HttpContext.Abort() anywhere are you? That might also explain this. In any case, getting some [trace-level logs from ASP.NET Core](https://docs.microsoft.com/en-us/aspnet/core/fundamentals/logging/?view=aspnetcore-3.0) might help us figure out what's going on here.

**Comment by tkstanczak** [comment]
@halter73 we are not calling abort

**Comment by halter73** [comment]
I think we're going to need trace-level logs to investigate this further then.
